{
  "unit": {
    "address": "123 Example St, Demo City, CA 99999",
    "rentToOwner": 2150,
    "utilitiesPaidBy": {
      "electric": "tenant",
      "gas": "owner",
      "water": "owner",
      "sewer": "owner",
      "trash": "owner",
      "internet": "unknown"
    },
    "contact": {
      "name": "Pat Smith",
      "role": "property_manager",
      "phone": "(555) 555-1212",
      "email": "pat@example.invalid"
    },
    "notes": "Available Jan 15. Two-car parking included."
  },
  "program": {
    "programType": "HUD-VASH",
    "zip": "99999",
    "phaName": "Demo Housing Authority",
    "phaCity": "Demo City"
  },
  "programGate": {
    "programGateStatus": "UNKNOWN",
    "grossRent": null,
    "utilityAllowance": null,
    "tenantShare": null,
    "initialRentBurden": null,
    "approvalBedroomCapSizeUsed": 1,
    "rentReasonablenessRisk": "UNKNOWN",
    "actionsRequired": [
      "Ask PHA for payment standard by bedroom size (studio/1/2/3/4) for zip 99999.",
      "Ask PHA for the utility allowance schedule and what counts as tenant-paid utilities.",
      "Ask PHA for your current TTP (Total Tenant Payment) or family share estimate."
    ],
    "notes": [
      "Utility allowance unknown; cannot compute gross rent or tenant share.",
      "programGateStatus=UNKNOWN due to missing: paymentStandard, TTP, utilityAllowance."
    ]
  },
  "legitimacy": {
    "legitimacyStatus": "NEEDS_VERIFICATION",
    "riskLevel": "MED",
    "riskScore": 52,
    "redFlags": [
      {
        "code": "NO_EXACT_ADDRESS",
        "severity": "MED",
        "evidence": "Address not provided in listing." 
      }
    ],
    "nextSteps": [
      "Get the exact address and verify it independently before proceeding."
    ]
  },
  "hqs": {
    "hqsStatus": "PASS_WITH_FIXES",
    "failReasons": [],
    "fixableItems": [
      "Missing/expired smoke detectors",
      "Missing/nonfunctional GFCI in kitchen/bath"
    ],
    "unknownItems": [
      "Bathroom ventilation unclear"
    ]
  }
}
